{
  "schema": "CoLivingHighlightAsset.v0.1",
  "asset_id": "CoCivium.CoCycleRegeneration.Highlight.R0",
  "receiver_scope": "Public-safe reader voluntarily exploring cyclic-regeneration hypotheses",
  "purpose": "Illustrate bounded replenishment, damping, risky positive feedback, correction and an evidence-safe G_d philosophical lane without claiming perpetual motion.",
  "salience_reason": "A new regenerative-loop question relates existing CoAmplificatory and CoLivingHighlight sources to one inspectable, falsifiable finite canary.",
  "source_bindings": [
    "github:CoCivium/CoCivium:docs/Architecture/COAMPLIFICATORY_CYCLIC_REGENERATION_R0_20261026.md@blob:f0e7834add3aa2b310f2c03602c4fb2ae68c1838",
    "github:CoCivium/CoCivium:docs/Architecture/COLIVING_HIGHLIGHT_R0.md@blob:dca1b55de78dd10d0167dd6411518f363f6f71a8",
    "github:CoCivium/CoCivium:docs/Architecture/COET_GD_SIGNAL_HYPOTHESIS_FINDERS_R0_20261024.md@blob:d3500d3de1667f49a954c8cdd45d56086e1fe80d",
    "branch:examples/copublication_federation_r0/cyclic_regeneration_canary_r0.json"
  ],
  "projection_ref": "examples/copublication_federation_r0/HIGHLIGHT_CYCLIC_REGENERATION_R0.md",
  "observed_at": "2026-10-26T05:27:07Z",
  "valid_time": null,
  "currentness": {
    "state": "UNKNOWN",
    "successor_ref": null,
    "change_feed_ref": null
  },
  "readiness": "CANDIDATE_SOURCE_BOUND_HIGHLIGHT_NOT_DEPLOYED_NOT_PHYSICS_OR_GD_PROOF",
  "uncertainty": [
    "Four recurrence paths use unitless synthetic values, not independently measured amplitudes or resources.",
    "No reader or public adoption measured.",
    "Resource replenishment, drive and retention require real source data to quantify.",
    "G_d denotes philosophical or proposed mathematical alternatives until discriminating empirical tests exist."
  ],
  "privacy_class": "PUBLIC_SAFE",
  "challenge_ref": "docs/Architecture/COAMPLIFICATORY_CYCLIC_REGENERATION_R0_20261026.md#first-proof",
  "projection_loss": [
    "Raw amplitude does not encode whether reader value, evidence or wellbeing improved.",
    "Finite simulation does not establish indefinite physical or organizational growth.",
    "Simplified feedback omits network effects, fatigue, energy cost, selection bias and ecological constraints.",
    "Public reader card omits private work and does not represent all CoTheoryAll interpretations."
  ],
  "read_mode": "SNAPSHOT_PINNED",
  "notes": [
    "A highlight relation is not intrinsic proof or marketing authority.",
    "Four finite scenarios: damping, bounded drive, unchecked reinforcement and corrective damping.",
    "Corrective damping of harmful agitation is an improvement, not a failure to amplify.",
    "Interpret G_d as a typed philosophy/hypothesis lane; do not claim divine or physical energy effects.",
    "No external sends, inferred consent, agent workers or publication to Substack."
  ]
}
